query,norm_base,expects_house,has_km,candidates,reason
"RUA SILVERIO IGNARRA SOBRINHO, 250 - VILA MONTEIRO - São Carlos/SP - CEP 13560-294","{'street': 'RUA SILVERIO IGNARRA SOBRINHO, 250, VILA MONTEIRO, SÃO CARLOS/SP', 'city': 'São Carlos', 'state': 'SP', 'country': 'Brasil', 'postalcode': '13560-294'}",False,False,"[{""street"": ""RUA SILVERIO IGNARRA SOBRINHO, 250, VILA MONTEIRO, SÃO CARLOS/SP"", ""city"": ""São Carlos"", ""state"": ""SP"", ""country"": ""Brasil"", ""postalcode"": ""13560-294""}, {""street"": ""RUA SILVERIO IGNARRA SOBRINHO, 250, VILA MONTEIRO, SÃO CARLOS/SP"", ""city"": ""São Carlos"", ""state"": ""SP"", ""country"": ""Brasil""}, {""postalcode"": ""13560-294"", ""city"": ""São Carlos"", ""state"": ""SP"", ""country"": ""Brasil""}, ""RUA SILVERIO IGNARRA SOBRINHO, 250, VILA MONTEIRO, SÃO CARLOS/SP, São Carlos, SP, Brasil""]",no_valid_hit
"RUA MARCOLINO LOPES BARRETO, 3013 - VILA COSTA DO SOL - São Carlos/SP - CEP 13566-210","{'street': 'RUA MARCOLINO LOPES BARRETO, 3013, VILA COSTA DO SOL, SÃO CARLOS/SP', 'city': 'São Carlos', 'state': 'SP', 'country': 'Brasil', 'postalcode': '13566-210'}",False,False,"[{""street"": ""RUA MARCOLINO LOPES BARRETO, 3013, VILA COSTA DO SOL, SÃO CARLOS/SP"", ""city"": ""São Carlos"", ""state"": ""SP"", ""country"": ""Brasil"", ""postalcode"": ""13566-210""}, {""street"": ""RUA MARCOLINO LOPES BARRETO, 3013, VILA COSTA DO SOL, SÃO CARLOS/SP"", ""city"": ""São Carlos"", ""state"": ""SP"", ""country"": ""Brasil""}, {""postalcode"": ""13566-210"", ""city"": ""São Carlos"", ""state"": ""SP"", ""country"": ""Brasil""}, ""RUA MARCOLINO LOPES BARRETO, 3013, VILA COSTA DO SOL, SÃO CARLOS/SP, São Carlos, SP, Brasil""]",no_valid_hit
"RUA FLAUZINO MARQUES, 215 - JARDIM ALVORADA - São Carlos/SP - CEP 13562-002","{'street': 'RUA FLAUZINO MARQUES, 215, JARDIM ALVORADA, SÃO CARLOS/SP', 'city': 'São Carlos', 'state': 'SP', 'country': 'Brasil', 'postalcode': '13562-002'}",False,False,"[{""street"": ""RUA FLAUZINO MARQUES, 215, JARDIM ALVORADA, SÃO CARLOS/SP"", ""city"": ""São Carlos"", ""state"": ""SP"", ""country"": ""Brasil"", ""postalcode"": ""13562-002""}, {""street"": ""RUA FLAUZINO MARQUES, 215, JARDIM ALVORADA, SÃO CARLOS/SP"", ""city"": ""São Carlos"", ""state"": ""SP"", ""country"": ""Brasil""}, {""postalcode"": ""13562-002"", ""city"": ""São Carlos"", ""state"": ""SP"", ""country"": ""Brasil""}, ""RUA FLAUZINO MARQUES, 215, JARDIM ALVORADA, SÃO CARLOS/SP, São Carlos, SP, Brasil""]",no_valid_hit
"RODOVIA ENGENHEIRO THALES DE LORENA PEIXOTO JUNIOR (SP 318), S/N - KM    246 - DISTRITO DE AGUA VERMELHA - São Carlos/SP - CEP 13578-000","{'street': 'ROD OVIA ENGENHEIRO THALES DE LORENA PEIXOTO JUNIOR, S/N, KM 246, DISTRITO DE AGUA VERMELHA, SÃO CARLOS/SP', 'city': 'São Carlos', 'state': 'SP', 'country': 'Brasil', 'postalcode': '13578-000'}",False,True,"[{""street"": ""ROD OVIA ENGENHEIRO THALES DE LORENA PEIXOTO JUNIOR, S/N, KM 246, DISTRITO DE AGUA VERMELHA, SÃO CARLOS/SP"", ""city"": ""São Carlos"", ""state"": ""SP"", ""country"": ""Brasil"", ""postalcode"": ""13578-000""}, {""street"": ""ROD OVIA ENGENHEIRO THALES DE LORENA PEIXOTO JUNIOR, S/N, KM 246, DISTRITO DE AGUA VERMELHA, SÃO CARLOS/SP"", ""city"": ""São Carlos"", ""state"": ""SP"", ""country"": ""Brasil""}, {""postalcode"": ""13578-000"", ""city"": ""São Carlos"", ""state"": ""SP"", ""country"": ""Brasil""}, ""ROD OVIA ENGENHEIRO THALES DE LORENA PEIXOTO JUNIOR, S/N, KM 246, DISTRITO DE AGUA VERMELHA, SÃO CARLOS/SP, São Carlos, SP, Brasil""]",no_valid_hit
"AVENIDA MORUMBI, 1251 - SALA  02,ALTOS - JARDIM MORUMBI - São Carlos/SP - CEP 13572-000","{'street': 'AV ENIDA MORUMBI, 1251', 'city': 'São Carlos', 'state': 'SP', 'country': 'Brasil', 'postalcode': '13572-000'}",True,False,"[{""street"": ""AV ENIDA MORUMBI, 1251"", ""city"": ""São Carlos"", ""state"": ""SP"", ""country"": ""Brasil"", ""postalcode"": ""13572-000""}, {""street"": ""AV ENIDA MORUMBI, 1251"", ""city"": ""São Carlos"", ""state"": ""SP"", ""country"": ""Brasil""}, {""postalcode"": ""13572-000"", ""city"": ""São Carlos"", ""state"": ""SP"", ""country"": ""Brasil""}, ""AV ENIDA MORUMBI, 1251, São Carlos, SP, Brasil""]",no_valid_hit
"RUA MARECHAL DEODORO, 1547 - SALA  02 - CENTRO - São Carlos/SP - CEP 13560-200","{'street': 'RUA MARECHAL DEODORO, 1547', 'city': 'São Carlos', 'state': 'SP', 'country': 'Brasil', 'postalcode': '13560-200'}",True,False,"[{""street"": ""RUA MARECHAL DEODORO, 1547"", ""city"": ""São Carlos"", ""state"": ""SP"", ""country"": ""Brasil"", ""postalcode"": ""13560-200""}, {""street"": ""RUA MARECHAL DEODORO, 1547"", ""city"": ""São Carlos"", ""state"": ""SP"", ""country"": ""Brasil""}, {""postalcode"": ""13560-200"", ""city"": ""São Carlos"", ""state"": ""SP"", ""country"": ""Brasil""}, ""RUA MARECHAL DEODORO, 1547, São Carlos, SP, Brasil""]",no_valid_hit
"RUA JESUINO DE ARRUDA, 1517 - JARDIM SAO CARLOS - São Carlos/SP - CEP 13560-642","{'street': 'RUA JESUINO DE ARRUDA, 1517, JARDIM SAO CARLOS, SÃO CARLOS/SP', 'city': 'São Carlos', 'state': 'SP', 'country': 'Brasil', 'postalcode': '13560-642'}",False,False,"[{""street"": ""RUA JESUINO DE ARRUDA, 1517, JARDIM SAO CARLOS, SÃO CARLOS/SP"", ""city"": ""São Carlos"", ""state"": ""SP"", ""country"": ""Brasil"", ""postalcode"": ""13560-642""}, {""street"": ""RUA JESUINO DE ARRUDA, 1517, JARDIM SAO CARLOS, SÃO CARLOS/SP"", ""city"": ""São Carlos"", ""state"": ""SP"", ""country"": ""Brasil""}, {""postalcode"": ""13560-642"", ""city"": ""São Carlos"", ""state"": ""SP"", ""country"": ""Brasil""}, ""RUA JESUINO DE ARRUDA, 1517, JARDIM SAO CARLOS, SÃO CARLOS/SP, São Carlos, SP, Brasil""]",no_valid_hit
"RUA CELIO BARBOSA DA SILVA, 150 - JD STA PAULA - São Carlos/SP - CEP 13564-060","{'street': 'RUA CELIO BARBOSA DA SILVA, 150, JD STA PAULA, SÃO CARLOS/SP', 'city': 'São Carlos', 'state': 'SP', 'country': 'Brasil', 'postalcode': '13564-060'}",False,False,"[{""street"": ""RUA CELIO BARBOSA DA SILVA, 150, JD STA PAULA, SÃO CARLOS/SP"", ""city"": ""São Carlos"", ""state"": ""SP"", ""country"": ""Brasil"", ""postalcode"": ""13564-060""}, {""street"": ""RUA CELIO BARBOSA DA SILVA, 150, JD STA PAULA, SÃO CARLOS/SP"", ""city"": ""São Carlos"", ""state"": ""SP"", ""country"": ""Brasil""}, {""postalcode"": ""13564-060"", ""city"": ""São Carlos"", ""state"": ""SP"", ""country"": ""Brasil""}, ""RUA CELIO BARBOSA DA SILVA, 150, JD STA PAULA, SÃO CARLOS/SP, São Carlos, SP, Brasil""]",no_valid_hit
"AVENIDA PROFESSORA MARIA DE CRESCI LEOPOLDINO, 755 - CASA  144 - CONDOMINIO RESIDENCIAL QUEBEC - São Carlos/SP - CEP 13563-623","{'street': 'AV ENIDA PROFESSORA MARIA DE CRESCI LEOPOLDINO, 755, CASA 144, CONDOMINIO RESIDENCIAL QUEBEC, SÃO CARLOS/SP', 'city': 'São Carlos', 'state': 'SP', 'country': 'Brasil', 'postalcode': '13563-623'}",False,False,"[{""street"": ""AV ENIDA PROFESSORA MARIA DE CRESCI LEOPOLDINO, 755, CASA 144, CONDOMINIO RESIDENCIAL QUEBEC, SÃO CARLOS/SP"", ""city"": ""São Carlos"", ""state"": ""SP"", ""country"": ""Brasil"", ""postalcode"": ""13563-623""}, {""street"": ""AV ENIDA PROFESSORA MARIA DE CRESCI LEOPOLDINO, 755, CASA 144, CONDOMINIO RESIDENCIAL QUEBEC, SÃO CARLOS/SP"", ""city"": ""São Carlos"", ""state"": ""SP"", ""country"": ""Brasil""}, {""postalcode"": ""13563-623"", ""city"": ""São Carlos"", ""state"": ""SP"", ""country"": ""Brasil""}, ""AV ENIDA PROFESSORA MARIA DE CRESCI LEOPOLDINO, 755, CASA 144, CONDOMINIO RESIDENCIAL QUEBEC, SÃO CARLOS/SP, São Carlos, SP, Brasil""]",no_valid_hit
"RUA MARECHAL DEODORO, 2616 - SALA  01 - CENTRO - São Carlos/SP - CEP 13560-201","{'street': 'RUA MARECHAL DEODORO, 2616', 'city': 'São Carlos', 'state': 'SP', 'country': 'Brasil', 'postalcode': '13560-201'}",True,False,"[{""street"": ""RUA MARECHAL DEODORO, 2616"", ""city"": ""São Carlos"", ""state"": ""SP"", ""country"": ""Brasil"", ""postalcode"": ""13560-201""}, {""street"": ""RUA MARECHAL DEODORO, 2616"", ""city"": ""São Carlos"", ""state"": ""SP"", ""country"": ""Brasil""}, {""postalcode"": ""13560-201"", ""city"": ""São Carlos"", ""state"": ""SP"", ""country"": ""Brasil""}, ""RUA MARECHAL DEODORO, 2616, São Carlos, SP, Brasil""]",no_valid_hit
"RUA MIGUEL PETRONI, 1145 - VILA PUREZA - São Carlos/SP - CEP 13561-002","{'street': 'RUA MIGUEL PETRONI, 1145, VILA PUREZA, SÃO CARLOS/SP', 'city': 'São Carlos', 'state': 'SP', 'country': 'Brasil', 'postalcode': '13561-002'}",False,False,"[{""street"": ""RUA MIGUEL PETRONI, 1145, VILA PUREZA, SÃO CARLOS/SP"", ""city"": ""São Carlos"", ""state"": ""SP"", ""country"": ""Brasil"", ""postalcode"": ""13561-002""}, {""street"": ""RUA MIGUEL PETRONI, 1145, VILA PUREZA, SÃO CARLOS/SP"", ""city"": ""São Carlos"", ""state"": ""SP"", ""country"": ""Brasil""}, {""postalcode"": ""13561-002"", ""city"": ""São Carlos"", ""state"": ""SP"", ""country"": ""Brasil""}, ""RUA MIGUEL PETRONI, 1145, VILA PUREZA, SÃO CARLOS/SP, São Carlos, SP, Brasil""]",no_valid_hit
"AVENIDA SAO CARLOS, 967 - SALA 01 - CENTRO - São Carlos/SP - CEP 13560-010","{'street': 'AV ENIDA SAO CARLOS, 967', 'city': 'São Carlos', 'state': 'SP', 'country': 'Brasil', 'postalcode': '13560-010'}",True,False,"[{""street"": ""AV ENIDA SAO CARLOS, 967"", ""city"": ""São Carlos"", ""state"": ""SP"", ""country"": ""Brasil"", ""postalcode"": ""13560-010""}, {""street"": ""AV ENIDA SAO CARLOS, 967"", ""city"": ""São Carlos"", ""state"": ""SP"", ""country"": ""Brasil""}, {""postalcode"": ""13560-010"", ""city"": ""São Carlos"", ""state"": ""SP"", ""country"": ""Brasil""}, ""AV ENIDA SAO CARLOS, 967, São Carlos, SP, Brasil""]",no_valid_hit
"RUA MARIA EUGENIA FABIANO, 432 - ANTENOR GARCIA - São Carlos/SP - CEP 13560-970","{'street': 'RUA MARIA EUGENIA FABIANO, 432, ANTENOR GARCIA, SÃO CARLOS/SP', 'city': 'São Carlos', 'state': 'SP', 'country': 'Brasil', 'postalcode': '13560-970'}",False,False,"[{""street"": ""RUA MARIA EUGENIA FABIANO, 432, ANTENOR GARCIA, SÃO CARLOS/SP"", ""city"": ""São Carlos"", ""state"": ""SP"", ""country"": ""Brasil"", ""postalcode"": ""13560-970""}, {""street"": ""RUA MARIA EUGENIA FABIANO, 432, ANTENOR GARCIA, SÃO CARLOS/SP"", ""city"": ""São Carlos"", ""state"": ""SP"", ""country"": ""Brasil""}, {""postalcode"": ""13560-970"", ""city"": ""São Carlos"", ""state"": ""SP"", ""country"": ""Brasil""}, ""RUA MARIA EUGENIA FABIANO, 432, ANTENOR GARCIA, SÃO CARLOS/SP, São Carlos, SP, Brasil""]",no_valid_hit
"AVENIDA SAO CARLOS, 2205 - SALA  707                 EDIF  RACZ CENTER - CENTRO - São Carlos/SP - CEP 13560-900","{'street': 'AV ENIDA SAO CARLOS, 2205', 'city': 'São Carlos', 'state': 'SP', 'country': 'Brasil', 'postalcode': '13560-900'}",True,False,"[{""street"": ""AV ENIDA SAO CARLOS, 2205"", ""city"": ""São Carlos"", ""state"": ""SP"", ""country"": ""Brasil"", ""postalcode"": ""13560-900""}, {""street"": ""AV ENIDA SAO CARLOS, 2205"", ""city"": ""São Carlos"", ""state"": ""SP"", ""country"": ""Brasil""}, {""postalcode"": ""13560-900"", ""city"": ""São Carlos"", ""state"": ""SP"", ""country"": ""Brasil""}, ""AV ENIDA SAO CARLOS, 2205, São Carlos, SP, Brasil""]",no_valid_hit
"AVENIDA PAPA PAULO VI, 1156 - VILA MONTE CARLO - São Carlos/SP - CEP 13572-140","{'street': 'AV ENIDA PAPA PAULO VI, 1156, VILA MONTE CARLO, SÃO CARLOS/SP', 'city': 'São Carlos', 'state': 'SP', 'country': 'Brasil', 'postalcode': '13572-140'}",False,False,"[{""street"": ""AV ENIDA PAPA PAULO VI, 1156, VILA MONTE CARLO, SÃO CARLOS/SP"", ""city"": ""São Carlos"", ""state"": ""SP"", ""country"": ""Brasil"", ""postalcode"": ""13572-140""}, {""street"": ""AV ENIDA PAPA PAULO VI, 1156, VILA MONTE CARLO, SÃO CARLOS/SP"", ""city"": ""São Carlos"", ""state"": ""SP"", ""country"": ""Brasil""}, {""postalcode"": ""13572-140"", ""city"": ""São Carlos"", ""state"": ""SP"", ""country"": ""Brasil""}, ""AV ENIDA PAPA PAULO VI, 1156, VILA MONTE CARLO, SÃO CARLOS/SP, São Carlos, SP, Brasil""]",no_valid_hit
"AVENIDA SALLUM, 979 - VILA PRADO - São Carlos/SP - CEP 13574-040","{'street': 'AV ENIDA SALLUM, 979, VILA PRADO, SÃO CARLOS/SP', 'city': 'São Carlos', 'state': 'SP', 'country': 'Brasil', 'postalcode': '13574-040'}",False,False,"[{""street"": ""AV ENIDA SALLUM, 979, VILA PRADO, SÃO CARLOS/SP"", ""city"": ""São Carlos"", ""state"": ""SP"", ""country"": ""Brasil"", ""postalcode"": ""13574-040""}, {""street"": ""AV ENIDA SALLUM, 979, VILA PRADO, SÃO CARLOS/SP"", ""city"": ""São Carlos"", ""state"": ""SP"", ""country"": ""Brasil""}, {""postalcode"": ""13574-040"", ""city"": ""São Carlos"", ""state"": ""SP"", ""country"": ""Brasil""}, ""AV ENIDA SALLUM, 979, VILA PRADO, SÃO CARLOS/SP, São Carlos, SP, Brasil""]",no_valid_hit
"RUA JOSE BONIFACIO, 565 - EDIF  ONOVOLAB - NUCLEO RESIDENCIAL SILVIO VILARI - São Carlos/SP - CEP 13560-610","{'street': 'RUA JOSE BONIFACIO, 565, EDIF ONOVOLAB, NUCLEO RESIDENCIAL SILVIO VILARI, SÃO CARLOS/SP', 'city': 'São Carlos', 'state': 'SP', 'country': 'Brasil', 'postalcode': '13560-610'}",False,False,"[{""street"": ""RUA JOSE BONIFACIO, 565, EDIF ONOVOLAB, NUCLEO RESIDENCIAL SILVIO VILARI, SÃO CARLOS/SP"", ""city"": ""São Carlos"", ""state"": ""SP"", ""country"": ""Brasil"", ""postalcode"": ""13560-610""}, {""street"": ""RUA JOSE BONIFACIO, 565, EDIF ONOVOLAB, NUCLEO RESIDENCIAL SILVIO VILARI, SÃO CARLOS/SP"", ""city"": ""São Carlos"", ""state"": ""SP"", ""country"": ""Brasil""}, {""postalcode"": ""13560-610"", ""city"": ""São Carlos"", ""state"": ""SP"", ""country"": ""Brasil""}, ""RUA JOSE BONIFACIO, 565, EDIF ONOVOLAB, NUCLEO RESIDENCIAL SILVIO VILARI, SÃO CARLOS/SP, São Carlos, SP, Brasil""]",no_valid_hit
"RUA MIGUEL PETRONI, 1659 - JARDIM BANDEIRANTES - São Carlos/SP - CEP 13562-190","{'street': 'RUA MIGUEL PETRONI, 1659, JARDIM BANDEIRANTES, SÃO CARLOS/SP', 'city': 'São Carlos', 'state': 'SP', 'country': 'Brasil', 'postalcode': '13562-190'}",False,False,"[{""street"": ""RUA MIGUEL PETRONI, 1659, JARDIM BANDEIRANTES, SÃO CARLOS/SP"", ""city"": ""São Carlos"", ""state"": ""SP"", ""country"": ""Brasil"", ""postalcode"": ""13562-190""}, {""street"": ""RUA MIGUEL PETRONI, 1659, JARDIM BANDEIRANTES, SÃO CARLOS/SP"", ""city"": ""São Carlos"", ""state"": ""SP"", ""country"": ""Brasil""}, {""postalcode"": ""13562-190"", ""city"": ""São Carlos"", ""state"": ""SP"", ""country"": ""Brasil""}, ""RUA MIGUEL PETRONI, 1659, JARDIM BANDEIRANTES, SÃO CARLOS/SP, São Carlos, SP, Brasil""]",no_valid_hit
"RUA ROSARIA CERRI CARUSO, 91 - N.RES.CASTELO BRANCO - São Carlos/SP - CEP 13571-110","{'street': 'RUA ROSARIA CERRI CARUSO, 91, N.RES.CASTELO BRANCO, SÃO CARLOS/SP', 'city': 'São Carlos', 'state': 'SP', 'country': 'Brasil', 'postalcode': '13571-110'}",False,False,"[{""street"": ""RUA ROSARIA CERRI CARUSO, 91, N.RES.CASTELO BRANCO, SÃO CARLOS/SP"", ""city"": ""São Carlos"", ""state"": ""SP"", ""country"": ""Brasil"", ""postalcode"": ""13571-110""}, {""street"": ""RUA ROSARIA CERRI CARUSO, 91, N.RES.CASTELO BRANCO, SÃO CARLOS/SP"", ""city"": ""São Carlos"", ""state"": ""SP"", ""country"": ""Brasil""}, {""postalcode"": ""13571-110"", ""city"": ""São Carlos"", ""state"": ""SP"", ""country"": ""Brasil""}, ""RUA ROSARIA CERRI CARUSO, 91, N.RES.CASTELO BRANCO, SÃO CARLOS/SP, São Carlos, SP, Brasil""]",no_valid_hit
"RUA EPISCOPAL, 2065 - LOJA A - CENTRO - São Carlos/SP - CEP 13560-049","{'street': 'RUA EPISCOPAL, 2065', 'city': 'São Carlos', 'state': 'SP', 'country': 'Brasil', 'postalcode': '13560-049'}",True,False,"[{""street"": ""RUA EPISCOPAL, 2065"", ""city"": ""São Carlos"", ""state"": ""SP"", ""country"": ""Brasil"", ""postalcode"": ""13560-049""}, {""street"": ""RUA EPISCOPAL, 2065"", ""city"": ""São Carlos"", ""state"": ""SP"", ""country"": ""Brasil""}, {""postalcode"": ""13560-049"", ""city"": ""São Carlos"", ""state"": ""SP"", ""country"": ""Brasil""}, ""RUA EPISCOPAL, 2065, São Carlos, SP, Brasil""]",no_valid_hit
"AVENIDA SAO CARLOS, 2434 - SALA 1 - CENTRO - São Carlos/SP - CEP 13560-002","{'street': 'AV ENIDA SAO CARLOS, 2434', 'city': 'São Carlos', 'state': 'SP', 'country': 'Brasil', 'postalcode': '13560-002'}",True,False,"[{""street"": ""AV ENIDA SAO CARLOS, 2434"", ""city"": ""São Carlos"", ""state"": ""SP"", ""country"": ""Brasil"", ""postalcode"": ""13560-002""}, {""street"": ""AV ENIDA SAO CARLOS, 2434"", ""city"": ""São Carlos"", ""state"": ""SP"", ""country"": ""Brasil""}, {""postalcode"": ""13560-002"", ""city"": ""São Carlos"", ""state"": ""SP"", ""country"": ""Brasil""}, ""AV ENIDA SAO CARLOS, 2434, São Carlos, SP, Brasil""]",no_valid_hit
"ALAMEDA DAS PITANGUEIRAS, 227 - PARQUE FABER CASTELL I - São Carlos/SP - CEP 13561-359","{'street': 'ALAMEDA DAS PITANGUEIRAS, 227, PARQUE FABER CASTELL I, SÃO CARLOS/SP', 'city': 'São Carlos', 'state': 'SP', 'country': 'Brasil', 'postalcode': '13561-359'}",False,False,"[{""street"": ""ALAMEDA DAS PITANGUEIRAS, 227, PARQUE FABER CASTELL I, SÃO CARLOS/SP"", ""city"": ""São Carlos"", ""state"": ""SP"", ""country"": ""Brasil"", ""postalcode"": ""13561-359""}, {""street"": ""ALAMEDA DAS PITANGUEIRAS, 227, PARQUE FABER CASTELL I, SÃO CARLOS/SP"", ""city"": ""São Carlos"", ""state"": ""SP"", ""country"": ""Brasil""}, {""postalcode"": ""13561-359"", ""city"": ""São Carlos"", ""state"": ""SP"", ""country"": ""Brasil""}, ""ALAMEDA DAS PITANGUEIRAS, 227, PARQUE FABER CASTELL I, SÃO CARLOS/SP, São Carlos, SP, Brasil""]",no_valid_hit
"RUA PAULO FRAGOSO COIMBRA, 258 - JARDIM ALVORADA - São Carlos/SP - CEP 13562-340","{'street': 'RUA PAULO FRAGOSO COIMBRA, 258, JARDIM ALVORADA, SÃO CARLOS/SP', 'city': 'São Carlos', 'state': 'SP', 'country': 'Brasil', 'postalcode': '13562-340'}",False,False,"[{""street"": ""RUA PAULO FRAGOSO COIMBRA, 258, JARDIM ALVORADA, SÃO CARLOS/SP"", ""city"": ""São Carlos"", ""state"": ""SP"", ""country"": ""Brasil"", ""postalcode"": ""13562-340""}, {""street"": ""RUA PAULO FRAGOSO COIMBRA, 258, JARDIM ALVORADA, SÃO CARLOS/SP"", ""city"": ""São Carlos"", ""state"": ""SP"", ""country"": ""Brasil""}, {""postalcode"": ""13562-340"", ""city"": ""São Carlos"", ""state"": ""SP"", ""country"": ""Brasil""}, ""RUA PAULO FRAGOSO COIMBRA, 258, JARDIM ALVORADA, SÃO CARLOS/SP, São Carlos, SP, Brasil""]",no_valid_hit
"RUA SAO JOAQUIM, 2793 - VILA COSTA DO SOL - São Carlos/SP - CEP 13566-280","{'street': 'RUA SAO JOAQUIM, 2793, VILA COSTA DO SOL, SÃO CARLOS/SP', 'city': 'São Carlos', 'state': 'SP', 'country': 'Brasil', 'postalcode': '13566-280'}",False,False,"[{""street"": ""RUA SAO JOAQUIM, 2793, VILA COSTA DO SOL, SÃO CARLOS/SP"", ""city"": ""São Carlos"", ""state"": ""SP"", ""country"": ""Brasil"", ""postalcode"": ""13566-280""}, {""street"": ""RUA SAO JOAQUIM, 2793, VILA COSTA DO SOL, SÃO CARLOS/SP"", ""city"": ""São Carlos"", ""state"": ""SP"", ""country"": ""Brasil""}, {""postalcode"": ""13566-280"", ""city"": ""São Carlos"", ""state"": ""SP"", ""country"": ""Brasil""}, ""RUA SAO JOAQUIM, 2793, VILA COSTA DO SOL, SÃO CARLOS/SP, São Carlos, SP, Brasil""]",no_valid_hit
"AVENIDA GETULIO VARGAS, 743 - LOJA  4 - VILA LUTFALLA - São Carlos/SP - CEP 13570-672","{'street': 'AV ENIDA GETULIO VARGAS, 743', 'city': 'São Carlos', 'state': 'SP', 'country': 'Brasil', 'postalcode': '13570-672'}",True,False,"[{""street"": ""AV ENIDA GETULIO VARGAS, 743"", ""city"": ""São Carlos"", ""state"": ""SP"", ""country"": ""Brasil"", ""postalcode"": ""13570-672""}, {""street"": ""AV ENIDA GETULIO VARGAS, 743"", ""city"": ""São Carlos"", ""state"": ""SP"", ""country"": ""Brasil""}, {""postalcode"": ""13570-672"", ""city"": ""São Carlos"", ""state"": ""SP"", ""country"": ""Brasil""}, ""AV ENIDA GETULIO VARGAS, 743, São Carlos, SP, Brasil""]",no_valid_hit
"RUA FRANCISCO SCHIAVONE, 1409 - VILA BOA VISTA - São Carlos/SP - CEP 13575-070","{'street': 'RUA FRANCISCO SCHIAVONE, 1409, VILA BOA VISTA, SÃO CARLOS/SP', 'city': 'São Carlos', 'state': 'SP', 'country': 'Brasil', 'postalcode': '13575-070'}",False,False,"[{""street"": ""RUA FRANCISCO SCHIAVONE, 1409, VILA BOA VISTA, SÃO CARLOS/SP"", ""city"": ""São Carlos"", ""state"": ""SP"", ""country"": ""Brasil"", ""postalcode"": ""13575-070""}, {""street"": ""RUA FRANCISCO SCHIAVONE, 1409, VILA BOA VISTA, SÃO CARLOS/SP"", ""city"": ""São Carlos"", ""state"": ""SP"", ""country"": ""Brasil""}, {""postalcode"": ""13575-070"", ""city"": ""São Carlos"", ""state"": ""SP"", ""country"": ""Brasil""}, ""RUA FRANCISCO SCHIAVONE, 1409, VILA BOA VISTA, SÃO CARLOS/SP, São Carlos, SP, Brasil""]",no_valid_hit
"AVENIDA MIGUEL DAMHA, 1400 - CASA  105 - PARQUE TECNOLOGICO DAMHA I SAO CARLOS - São Carlos/SP - CEP 13565-251","{'street': 'AV ENIDA MIGUEL DAMHA, 1400, CASA 105, PARQUE TECNOLOGICO DAMHA I SAO CARLOS, SÃO CARLOS/SP', 'city': 'São Carlos', 'state': 'SP', 'country': 'Brasil', 'postalcode': '13565-251'}",False,False,"[{""street"": ""AV ENIDA MIGUEL DAMHA, 1400, CASA 105, PARQUE TECNOLOGICO DAMHA I SAO CARLOS, SÃO CARLOS/SP"", ""city"": ""São Carlos"", ""state"": ""SP"", ""country"": ""Brasil"", ""postalcode"": ""13565-251""}, {""street"": ""AV ENIDA MIGUEL DAMHA, 1400, CASA 105, PARQUE TECNOLOGICO DAMHA I SAO CARLOS, SÃO CARLOS/SP"", ""city"": ""São Carlos"", ""state"": ""SP"", ""country"": ""Brasil""}, {""postalcode"": ""13565-251"", ""city"": ""São Carlos"", ""state"": ""SP"", ""country"": ""Brasil""}, ""AV ENIDA MIGUEL DAMHA, 1400, CASA 105, PARQUE TECNOLOGICO DAMHA I SAO CARLOS, SÃO CARLOS/SP, São Carlos, SP, Brasil""]",no_valid_hit
"RUA RUA CANDIDO PADIM, 454 - VILA PRADO - São Carlos/SP - CEP 13574-320","{'street': 'RUA RUA CANDIDO PADIM, 454, VILA PRADO, SÃO CARLOS/SP', 'city': 'São Carlos', 'state': 'SP', 'country': 'Brasil', 'postalcode': '13574-320'}",False,False,"[{""street"": ""RUA RUA CANDIDO PADIM, 454, VILA PRADO, SÃO CARLOS/SP"", ""city"": ""São Carlos"", ""state"": ""SP"", ""country"": ""Brasil"", ""postalcode"": ""13574-320""}, {""street"": ""RUA RUA CANDIDO PADIM, 454, VILA PRADO, SÃO CARLOS/SP"", ""city"": ""São Carlos"", ""state"": ""SP"", ""country"": ""Brasil""}, {""postalcode"": ""13574-320"", ""city"": ""São Carlos"", ""state"": ""SP"", ""country"": ""Brasil""}, ""RUA RUA CANDIDO PADIM, 454, VILA PRADO, SÃO CARLOS/SP, São Carlos, SP, Brasil""]",no_valid_hit
"RUA JOSE CALIJURI, 296 - FUNDOS - JARDIM HIKARI - São Carlos/SP - CEP 13564-430","{'street': 'RUA JOSE CALIJURI, 296', 'city': 'São Carlos', 'state': 'SP', 'country': 'Brasil', 'postalcode': '13564-430'}",True,False,"[{""street"": ""RUA JOSE CALIJURI, 296"", ""city"": ""São Carlos"", ""state"": ""SP"", ""country"": ""Brasil"", ""postalcode"": ""13564-430""}, {""street"": ""RUA JOSE CALIJURI, 296"", ""city"": ""São Carlos"", ""state"": ""SP"", ""country"": ""Brasil""}, {""postalcode"": ""13564-430"", ""city"": ""São Carlos"", ""state"": ""SP"", ""country"": ""Brasil""}, ""RUA JOSE CALIJURI, 296, São Carlos, SP, Brasil""]",no_valid_hit
"RUA PASSEIO DOS FLAMBOYANTS, 60 - SALA  406                 COND  TRIADE                    PREDIO SAO PAULO - PARQUE FABER CASTELL I - São Carlos/SP - CEP 13561-352","{'street': 'RUA PASSEIO DOS FLAMBOYANTS, 60', 'city': 'São Carlos', 'state': 'SP', 'country': 'Brasil', 'postalcode': '13561-352'}",True,False,"[{""street"": ""RUA PASSEIO DOS FLAMBOYANTS, 60"", ""city"": ""São Carlos"", ""state"": ""SP"", ""country"": ""Brasil"", ""postalcode"": ""13561-352""}, {""street"": ""RUA PASSEIO DOS FLAMBOYANTS, 60"", ""city"": ""São Carlos"", ""state"": ""SP"", ""country"": ""Brasil""}, {""postalcode"": ""13561-352"", ""city"": ""São Carlos"", ""state"": ""SP"", ""country"": ""Brasil""}, ""RUA PASSEIO DOS FLAMBOYANTS, 60, São Carlos, SP, Brasil""]",no_valid_hit
"RUA MANOEL JOSE SERPA, 127 - FUNDOS - PLANALTO PARAISO - São Carlos/SP - CEP 13562-070","{'street': 'RUA MANOEL JOSE SERPA, 127', 'city': 'São Carlos', 'state': 'SP', 'country': 'Brasil', 'postalcode': '13562-070'}",True,False,"[{""street"": ""RUA MANOEL JOSE SERPA, 127"", ""city"": ""São Carlos"", ""state"": ""SP"", ""country"": ""Brasil"", ""postalcode"": ""13562-070""}, {""street"": ""RUA MANOEL JOSE SERPA, 127"", ""city"": ""São Carlos"", ""state"": ""SP"", ""country"": ""Brasil""}, {""postalcode"": ""13562-070"", ""city"": ""São Carlos"", ""state"": ""SP"", ""country"": ""Brasil""}, ""RUA MANOEL JOSE SERPA, 127, São Carlos, SP, Brasil""]",no_valid_hit
"RUA MARECHAL DEODORO, 2115 - EDIF EMILIO MANZANO;LOJA 15 - CENTRO - São Carlos/SP - CEP 13560-200","{'street': 'RUA MARECHAL DEODORO, 2115, EDIF EMILIO MANZANO;LOJA 15, CENTRO, SÃO CARLOS/SP', 'city': 'São Carlos', 'state': 'SP', 'country': 'Brasil', 'postalcode': '13560-200'}",False,False,"[{""street"": ""RUA MARECHAL DEODORO, 2115, EDIF EMILIO MANZANO;LOJA 15, CENTRO, SÃO CARLOS/SP"", ""city"": ""São Carlos"", ""state"": ""SP"", ""country"": ""Brasil"", ""postalcode"": ""13560-200""}, {""street"": ""RUA MARECHAL DEODORO, 2115, EDIF EMILIO MANZANO;LOJA 15, CENTRO, SÃO CARLOS/SP"", ""city"": ""São Carlos"", ""state"": ""SP"", ""country"": ""Brasil""}, {""postalcode"": ""13560-200"", ""city"": ""São Carlos"", ""state"": ""SP"", ""country"": ""Brasil""}, ""RUA MARECHAL DEODORO, 2115, EDIF EMILIO MANZANO;LOJA 15, CENTRO, SÃO CARLOS/SP, São Carlos, SP, Brasil""]",no_valid_hit
