query,norm_base,expects_house,has_km,candidates,reason
"RUA DONA ALEXANDRINA, 1969 - CASA  B - VILA MONTEIRO (GLEBA1) - São Carlos/SP - CEP 13560-290","{'street': 'RUA DONA ALEXANDRINA, 1969, CASA B, VILA MONTEIRO, SÃO CARLOS/SP', 'city': 'São Carlos', 'state': 'SP', 'country': 'Brasil', 'postalcode': '13560-290'}",False,False,"[{""street"": ""RUA DONA ALEXANDRINA, 1969, CASA B, VILA MONTEIRO, SÃO CARLOS/SP"", ""city"": ""São Carlos"", ""state"": ""SP"", ""country"": ""Brasil"", ""postalcode"": ""13560-290""}, {""street"": ""RUA DONA ALEXANDRINA, 1969, CASA B, VILA MONTEIRO, SÃO CARLOS/SP"", ""city"": ""São Carlos"", ""state"": ""SP"", ""country"": ""Brasil""}, {""postalcode"": ""13560-290"", ""city"": ""São Carlos"", ""state"": ""SP"", ""country"": ""Brasil""}, ""RUA DONA ALEXANDRINA, 1969, CASA B, VILA MONTEIRO, SÃO CARLOS/SP, São Carlos, SP, Brasil""]",no_valid_hit
"RUA ALEXANDRE PEDRAZZANI, 375 - SALA  2 - JARDIM NOVO HORIZONTE - São Carlos/SP - CEP 13571-512","{'street': 'RUA ALEXANDRE PEDRAZZANI, 375', 'city': 'São Carlos', 'state': 'SP', 'country': 'Brasil', 'postalcode': '13571-512'}",True,False,"[{""street"": ""RUA ALEXANDRE PEDRAZZANI, 375"", ""city"": ""São Carlos"", ""state"": ""SP"", ""country"": ""Brasil"", ""postalcode"": ""13571-512""}, {""street"": ""RUA ALEXANDRE PEDRAZZANI, 375"", ""city"": ""São Carlos"", ""state"": ""SP"", ""country"": ""Brasil""}, {""postalcode"": ""13571-512"", ""city"": ""São Carlos"", ""state"": ""SP"", ""country"": ""Brasil""}, ""RUA ALEXANDRE PEDRAZZANI, 375, São Carlos, SP, Brasil""]",no_valid_hit
"AVENIDA JOAO DE LOURENCO, 115 - PARQUE RESIDENCIAL MARIA STELLA FAGA - São Carlos/SP - CEP 13568-250","{'street': 'AV ENIDA JOAO DE LOURENCO, 115, PARQUE RESIDENCIAL MARIA STELLA FAGA, SÃO CARLOS/SP', 'city': 'São Carlos', 'state': 'SP', 'country': 'Brasil', 'postalcode': '13568-250'}",False,False,"[{""street"": ""AV ENIDA JOAO DE LOURENCO, 115, PARQUE RESIDENCIAL MARIA STELLA FAGA, SÃO CARLOS/SP"", ""city"": ""São Carlos"", ""state"": ""SP"", ""country"": ""Brasil"", ""postalcode"": ""13568-250""}, {""street"": ""AV ENIDA JOAO DE LOURENCO, 115, PARQUE RESIDENCIAL MARIA STELLA FAGA, SÃO CARLOS/SP"", ""city"": ""São Carlos"", ""state"": ""SP"", ""country"": ""Brasil""}, {""postalcode"": ""13568-250"", ""city"": ""São Carlos"", ""state"": ""SP"", ""country"": ""Brasil""}, ""AV ENIDA JOAO DE LOURENCO, 115, PARQUE RESIDENCIAL MARIA STELLA FAGA, SÃO CARLOS/SP, São Carlos, SP, Brasil""]",no_valid_hit
"PASSEIO DOS FLAMBOYANTS, 320 - COND  TRIADE              EDIF  LONDRES             CONJ  103 - PARQUE FABER CASTELL I - São Carlos/SP - CEP 13561-352","{'street': 'PASSEIO DOS FLAMBOYANTS, 320, COND TRIADE EDIF LONDRES CONJ 103, PARQUE FABER CASTELL I, SÃO CARLOS/SP', 'city': 'São Carlos', 'state': 'SP', 'country': 'Brasil', 'postalcode': '13561-352'}",False,False,"[{""street"": ""PASSEIO DOS FLAMBOYANTS, 320, COND TRIADE EDIF LONDRES CONJ 103, PARQUE FABER CASTELL I, SÃO CARLOS/SP"", ""city"": ""São Carlos"", ""state"": ""SP"", ""country"": ""Brasil"", ""postalcode"": ""13561-352""}, {""street"": ""PASSEIO DOS FLAMBOYANTS, 320, COND TRIADE EDIF LONDRES CONJ 103, PARQUE FABER CASTELL I, SÃO CARLOS/SP"", ""city"": ""São Carlos"", ""state"": ""SP"", ""country"": ""Brasil""}, {""postalcode"": ""13561-352"", ""city"": ""São Carlos"", ""state"": ""SP"", ""country"": ""Brasil""}, ""PASSEIO DOS FLAMBOYANTS, 320, COND TRIADE EDIF LONDRES CONJ 103, PARQUE FABER CASTELL I, SÃO CARLOS/SP, São Carlos, SP, Brasil""]",no_valid_hit
"AVENIDA TEIXEIRA DE BARROS, 887 - ANDAR: 1; - VILA PRADO - São Carlos/SP - CEP 13574-033","{'street': 'AV ENIDA TEIXEIRA DE BARROS, 887', 'city': 'São Carlos', 'state': 'SP', 'country': 'Brasil', 'postalcode': '13574-033'}",True,False,"[{""street"": ""AV ENIDA TEIXEIRA DE BARROS, 887"", ""city"": ""São Carlos"", ""state"": ""SP"", ""country"": ""Brasil"", ""postalcode"": ""13574-033""}, {""street"": ""AV ENIDA TEIXEIRA DE BARROS, 887"", ""city"": ""São Carlos"", ""state"": ""SP"", ""country"": ""Brasil""}, {""postalcode"": ""13574-033"", ""city"": ""São Carlos"", ""state"": ""SP"", ""country"": ""Brasil""}, ""AV ENIDA TEIXEIRA DE BARROS, 887, São Carlos, SP, Brasil""]",no_valid_hit
"AVENIDA COMENDADOR ALFREDO MAFFEI, 2542 - BOX   023 - JARDIM GIBERTONI - São Carlos/SP - CEP 13561-270","{'street': 'AV ENIDA COMENDADOR ALFREDO MAFFEI, 2542', 'city': 'São Carlos', 'state': 'SP', 'country': 'Brasil', 'postalcode': '13561-270'}",True,False,"[{""street"": ""AV ENIDA COMENDADOR ALFREDO MAFFEI, 2542"", ""city"": ""São Carlos"", ""state"": ""SP"", ""country"": ""Brasil"", ""postalcode"": ""13561-270""}, {""street"": ""AV ENIDA COMENDADOR ALFREDO MAFFEI, 2542"", ""city"": ""São Carlos"", ""state"": ""SP"", ""country"": ""Brasil""}, {""postalcode"": ""13561-270"", ""city"": ""São Carlos"", ""state"": ""SP"", ""country"": ""Brasil""}, ""AV ENIDA COMENDADOR ALFREDO MAFFEI, 2542, São Carlos, SP, Brasil""]",no_valid_hit
"RUA MIGUEL PETRONI, 4900 - CASA  19                  SALA  1 - RESIDENCIAL ELDORADO - São Carlos/SP - CEP 13563-691","{'street': 'RUA MIGUEL PETRONI, 4900, CASA 19 SALA 1, RESIDENCIAL ELDORADO, SÃO CARLOS/SP', 'city': 'São Carlos', 'state': 'SP', 'country': 'Brasil', 'postalcode': '13563-691'}",False,False,"[{""street"": ""RUA MIGUEL PETRONI, 4900, CASA 19 SALA 1, RESIDENCIAL ELDORADO, SÃO CARLOS/SP"", ""city"": ""São Carlos"", ""state"": ""SP"", ""country"": ""Brasil"", ""postalcode"": ""13563-691""}, {""street"": ""RUA MIGUEL PETRONI, 4900, CASA 19 SALA 1, RESIDENCIAL ELDORADO, SÃO CARLOS/SP"", ""city"": ""São Carlos"", ""state"": ""SP"", ""country"": ""Brasil""}, {""postalcode"": ""13563-691"", ""city"": ""São Carlos"", ""state"": ""SP"", ""country"": ""Brasil""}, ""RUA MIGUEL PETRONI, 4900, CASA 19 SALA 1, RESIDENCIAL ELDORADO, SÃO CARLOS/SP, São Carlos, SP, Brasil""]",no_valid_hit
"RUA TREZE DE MAIO, 2876 - JARDIM SAO CARLOS - São Carlos/SP - CEP 13560-647","{'street': 'RUA TREZE DE MAIO, 2876, JARDIM SAO CARLOS, SÃO CARLOS/SP', 'city': 'São Carlos', 'state': 'SP', 'country': 'Brasil', 'postalcode': '13560-647'}",False,False,"[{""street"": ""RUA TREZE DE MAIO, 2876, JARDIM SAO CARLOS, SÃO CARLOS/SP"", ""city"": ""São Carlos"", ""state"": ""SP"", ""country"": ""Brasil"", ""postalcode"": ""13560-647""}, {""street"": ""RUA TREZE DE MAIO, 2876, JARDIM SAO CARLOS, SÃO CARLOS/SP"", ""city"": ""São Carlos"", ""state"": ""SP"", ""country"": ""Brasil""}, {""postalcode"": ""13560-647"", ""city"": ""São Carlos"", ""state"": ""SP"", ""country"": ""Brasil""}, ""RUA TREZE DE MAIO, 2876, JARDIM SAO CARLOS, SÃO CARLOS/SP, São Carlos, SP, Brasil""]",no_valid_hit
"RUA RUA ODETTE DE CAMPOS DAMHA, 77 - CHACARA SAO JOAO - São Carlos/SP - CEP 13569-220","{'street': 'RUA RUA ODETTE DE CAMPOS DAMHA, 77, CHACARA SAO JOAO, SÃO CARLOS/SP', 'city': 'São Carlos', 'state': 'SP', 'country': 'Brasil', 'postalcode': '13569-220'}",False,False,"[{""street"": ""RUA RUA ODETTE DE CAMPOS DAMHA, 77, CHACARA SAO JOAO, SÃO CARLOS/SP"", ""city"": ""São Carlos"", ""state"": ""SP"", ""country"": ""Brasil"", ""postalcode"": ""13569-220""}, {""street"": ""RUA RUA ODETTE DE CAMPOS DAMHA, 77, CHACARA SAO JOAO, SÃO CARLOS/SP"", ""city"": ""São Carlos"", ""state"": ""SP"", ""country"": ""Brasil""}, {""postalcode"": ""13569-220"", ""city"": ""São Carlos"", ""state"": ""SP"", ""country"": ""Brasil""}, ""RUA RUA ODETTE DE CAMPOS DAMHA, 77, CHACARA SAO JOAO, SÃO CARLOS/SP, São Carlos, SP, Brasil""]",no_valid_hit
"RUA ALFEO AMBROGIO, 735 - FUNDOSSALA A - JARDIM MERCEDES - São Carlos/SP - CEP 13570-540","{'street': 'RUA ALFEO AMBROGIO, 735, FUNDOSSALA A, JARDIM MERCEDES, SÃO CARLOS/SP', 'city': 'São Carlos', 'state': 'SP', 'country': 'Brasil', 'postalcode': '13570-540'}",False,False,"[{""street"": ""RUA ALFEO AMBROGIO, 735, FUNDOSSALA A, JARDIM MERCEDES, SÃO CARLOS/SP"", ""city"": ""São Carlos"", ""state"": ""SP"", ""country"": ""Brasil"", ""postalcode"": ""13570-540""}, {""street"": ""RUA ALFEO AMBROGIO, 735, FUNDOSSALA A, JARDIM MERCEDES, SÃO CARLOS/SP"", ""city"": ""São Carlos"", ""state"": ""SP"", ""country"": ""Brasil""}, {""postalcode"": ""13570-540"", ""city"": ""São Carlos"", ""state"": ""SP"", ""country"": ""Brasil""}, ""RUA ALFEO AMBROGIO, 735, FUNDOSSALA A, JARDIM MERCEDES, SÃO CARLOS/SP, São Carlos, SP, Brasil""]",no_valid_hit
"PASSEIO DAS MAGNOLIAS, 121 - APT   81                  EDIF  WASSILY KANDINSKY - PARQUE FABER CASTELL I - São Carlos/SP - CEP 13561-381","{'street': 'PASSEIO DAS MAGNOLIAS, 121', 'city': 'São Carlos', 'state': 'SP', 'country': 'Brasil', 'postalcode': '13561-381'}",True,False,"[{""street"": ""PASSEIO DAS MAGNOLIAS, 121"", ""city"": ""São Carlos"", ""state"": ""SP"", ""country"": ""Brasil"", ""postalcode"": ""13561-381""}, {""street"": ""PASSEIO DAS MAGNOLIAS, 121"", ""city"": ""São Carlos"", ""state"": ""SP"", ""country"": ""Brasil""}, {""postalcode"": ""13561-381"", ""city"": ""São Carlos"", ""state"": ""SP"", ""country"": ""Brasil""}, ""PASSEIO DAS MAGNOLIAS, 121, São Carlos, SP, Brasil""]",no_valid_hit
"RUA FRANCISCO DE OLIVEIRA PENTEADO, 120 - BOA VISTA - São Carlos/SP - CEP 13574-011","{'street': 'RUA FRANCISCO DE OLIVEIRA PENTEADO, 120, BOA VISTA, SÃO CARLOS/SP', 'city': 'São Carlos', 'state': 'SP', 'country': 'Brasil', 'postalcode': '13574-011'}",False,False,"[{""street"": ""RUA FRANCISCO DE OLIVEIRA PENTEADO, 120, BOA VISTA, SÃO CARLOS/SP"", ""city"": ""São Carlos"", ""state"": ""SP"", ""country"": ""Brasil"", ""postalcode"": ""13574-011""}, {""street"": ""RUA FRANCISCO DE OLIVEIRA PENTEADO, 120, BOA VISTA, SÃO CARLOS/SP"", ""city"": ""São Carlos"", ""state"": ""SP"", ""country"": ""Brasil""}, {""postalcode"": ""13574-011"", ""city"": ""São Carlos"", ""state"": ""SP"", ""country"": ""Brasil""}, ""RUA FRANCISCO DE OLIVEIRA PENTEADO, 120, BOA VISTA, SÃO CARLOS/SP, São Carlos, SP, Brasil""]",no_valid_hit
"RUA ANTONIO RODRIGUES CAJADO, 1384 - SALA  B 2 A - VILA MONTEIRO (GLEBA I) - São Carlos/SP - CEP 13560-291","{'street': 'RUA ANTONIO ROD RIGUES CAJADO, 1384', 'city': 'São Carlos', 'state': 'SP', 'country': 'Brasil', 'postalcode': '13560-291'}",True,False,"[{""street"": ""RUA ANTONIO ROD RIGUES CAJADO, 1384"", ""city"": ""São Carlos"", ""state"": ""SP"", ""country"": ""Brasil"", ""postalcode"": ""13560-291""}, {""street"": ""RUA ANTONIO ROD RIGUES CAJADO, 1384"", ""city"": ""São Carlos"", ""state"": ""SP"", ""country"": ""Brasil""}, {""postalcode"": ""13560-291"", ""city"": ""São Carlos"", ""state"": ""SP"", ""country"": ""Brasil""}, ""RUA ANTONIO ROD RIGUES CAJADO, 1384, São Carlos, SP, Brasil""]",no_valid_hit
"AVENIDA SAO CARLOS, 1553 - CENTRO - São Carlos/SP - CEP 13560-010","{'street': 'AV ENIDA SAO CARLOS, 1553, CENTRO, SÃO CARLOS/SP', 'city': 'São Carlos', 'state': 'SP', 'country': 'Brasil', 'postalcode': '13560-010'}",False,False,"[{""street"": ""AV ENIDA SAO CARLOS, 1553, CENTRO, SÃO CARLOS/SP"", ""city"": ""São Carlos"", ""state"": ""SP"", ""country"": ""Brasil"", ""postalcode"": ""13560-010""}, {""street"": ""AV ENIDA SAO CARLOS, 1553, CENTRO, SÃO CARLOS/SP"", ""city"": ""São Carlos"", ""state"": ""SP"", ""country"": ""Brasil""}, {""postalcode"": ""13560-010"", ""city"": ""São Carlos"", ""state"": ""SP"", ""country"": ""Brasil""}, ""AV ENIDA SAO CARLOS, 1553, CENTRO, SÃO CARLOS/SP, São Carlos, SP, Brasil""]",no_valid_hit
"RUA ANDRE RINALDI PETRONI, 55 - SALA  2 - JARDIM PAULISTA - São Carlos/SP - CEP 13574-490","{'street': 'RUA ANDRE RINALDI PETRONI, 55', 'city': 'São Carlos', 'state': 'SP', 'country': 'Brasil', 'postalcode': '13574-490'}",True,False,"[{""street"": ""RUA ANDRE RINALDI PETRONI, 55"", ""city"": ""São Carlos"", ""state"": ""SP"", ""country"": ""Brasil"", ""postalcode"": ""13574-490""}, {""street"": ""RUA ANDRE RINALDI PETRONI, 55"", ""city"": ""São Carlos"", ""state"": ""SP"", ""country"": ""Brasil""}, {""postalcode"": ""13574-490"", ""city"": ""São Carlos"", ""state"": ""SP"", ""country"": ""Brasil""}, ""RUA ANDRE RINALDI PETRONI, 55, São Carlos, SP, Brasil""]",no_valid_hit
"RUA AMBROSIO DOS SANTOS, 394 - PLANALTO PARAISO - São Carlos/SP - CEP 13562-000","{'street': 'RUA AMBROSIO DOS SANTOS, 394, PLANALTO PARAISO, SÃO CARLOS/SP', 'city': 'São Carlos', 'state': 'SP', 'country': 'Brasil', 'postalcode': '13562-000'}",False,False,"[{""street"": ""RUA AMBROSIO DOS SANTOS, 394, PLANALTO PARAISO, SÃO CARLOS/SP"", ""city"": ""São Carlos"", ""state"": ""SP"", ""country"": ""Brasil"", ""postalcode"": ""13562-000""}, {""street"": ""RUA AMBROSIO DOS SANTOS, 394, PLANALTO PARAISO, SÃO CARLOS/SP"", ""city"": ""São Carlos"", ""state"": ""SP"", ""country"": ""Brasil""}, {""postalcode"": ""13562-000"", ""city"": ""São Carlos"", ""state"": ""SP"", ""country"": ""Brasil""}, ""RUA AMBROSIO DOS SANTOS, 394, PLANALTO PARAISO, SÃO CARLOS/SP, São Carlos, SP, Brasil""]",no_valid_hit
"AVENIDA PROFESSOR LUIZ AUGUSTO DE OLIVEIRA, 91 - SALA  15 - VILA MARINA - São Carlos/SP - CEP 13566-340","{'street': 'AV ENIDA PROFESSOR LUIZ AUGUSTO DE OLIVEIRA, 91', 'city': 'São Carlos', 'state': 'SP', 'country': 'Brasil', 'postalcode': '13566-340'}",True,False,"[{""street"": ""AV ENIDA PROFESSOR LUIZ AUGUSTO DE OLIVEIRA, 91"", ""city"": ""São Carlos"", ""state"": ""SP"", ""country"": ""Brasil"", ""postalcode"": ""13566-340""}, {""street"": ""AV ENIDA PROFESSOR LUIZ AUGUSTO DE OLIVEIRA, 91"", ""city"": ""São Carlos"", ""state"": ""SP"", ""country"": ""Brasil""}, {""postalcode"": ""13566-340"", ""city"": ""São Carlos"", ""state"": ""SP"", ""country"": ""Brasil""}, ""AV ENIDA PROFESSOR LUIZ AUGUSTO DE OLIVEIRA, 91, São Carlos, SP, Brasil""]",no_valid_hit
"RUA JULIO PRESTES DE ALBUQUERQUE, 280 - VILA JACOBUCCI - São Carlos/SP - CEP 13567-232","{'street': 'RUA JULIO PRESTES DE ALBUQUERQUE, 280, VILA JACOBUCCI, SÃO CARLOS/SP', 'city': 'São Carlos', 'state': 'SP', 'country': 'Brasil', 'postalcode': '13567-232'}",False,False,"[{""street"": ""RUA JULIO PRESTES DE ALBUQUERQUE, 280, VILA JACOBUCCI, SÃO CARLOS/SP"", ""city"": ""São Carlos"", ""state"": ""SP"", ""country"": ""Brasil"", ""postalcode"": ""13567-232""}, {""street"": ""RUA JULIO PRESTES DE ALBUQUERQUE, 280, VILA JACOBUCCI, SÃO CARLOS/SP"", ""city"": ""São Carlos"", ""state"": ""SP"", ""country"": ""Brasil""}, {""postalcode"": ""13567-232"", ""city"": ""São Carlos"", ""state"": ""SP"", ""country"": ""Brasil""}, ""RUA JULIO PRESTES DE ALBUQUERQUE, 280, VILA JACOBUCCI, SÃO CARLOS/SP, São Carlos, SP, Brasil""]",no_valid_hit
"RUA MANOEL JOAQUIM, 55 - CIDADE ARACY - São Carlos/SP - CEP 13573-118","{'street': 'RUA MANOEL JOAQUIM, 55, CIDADE ARACY, SÃO CARLOS/SP', 'city': 'São Carlos', 'state': 'SP', 'country': 'Brasil', 'postalcode': '13573-118'}",False,False,"[{""street"": ""RUA MANOEL JOAQUIM, 55, CIDADE ARACY, SÃO CARLOS/SP"", ""city"": ""São Carlos"", ""state"": ""SP"", ""country"": ""Brasil"", ""postalcode"": ""13573-118""}, {""street"": ""RUA MANOEL JOAQUIM, 55, CIDADE ARACY, SÃO CARLOS/SP"", ""city"": ""São Carlos"", ""state"": ""SP"", ""country"": ""Brasil""}, {""postalcode"": ""13573-118"", ""city"": ""São Carlos"", ""state"": ""SP"", ""country"": ""Brasil""}, ""RUA MANOEL JOAQUIM, 55, CIDADE ARACY, SÃO CARLOS/SP, São Carlos, SP, Brasil""]",no_valid_hit
"RUA EPISCOPAL, 2055 - CENTRO - São Carlos/SP - CEP 13560-049","{'street': 'RUA EPISCOPAL, 2055, CENTRO, SÃO CARLOS/SP', 'city': 'São Carlos', 'state': 'SP', 'country': 'Brasil', 'postalcode': '13560-049'}",False,False,"[{""street"": ""RUA EPISCOPAL, 2055, CENTRO, SÃO CARLOS/SP"", ""city"": ""São Carlos"", ""state"": ""SP"", ""country"": ""Brasil"", ""postalcode"": ""13560-049""}, {""street"": ""RUA EPISCOPAL, 2055, CENTRO, SÃO CARLOS/SP"", ""city"": ""São Carlos"", ""state"": ""SP"", ""country"": ""Brasil""}, {""postalcode"": ""13560-049"", ""city"": ""São Carlos"", ""state"": ""SP"", ""country"": ""Brasil""}, ""RUA EPISCOPAL, 2055, CENTRO, SÃO CARLOS/SP, São Carlos, SP, Brasil""]",no_valid_hit
"RUA DONA ALEXANDRINA, 366 - SALA  02 - VILA MONTEIRO - São Carlos/SP - CEP 13560-290","{'street': 'RUA DONA ALEXANDRINA, 366', 'city': 'São Carlos', 'state': 'SP', 'country': 'Brasil', 'postalcode': '13560-290'}",True,False,"[{""street"": ""RUA DONA ALEXANDRINA, 366"", ""city"": ""São Carlos"", ""state"": ""SP"", ""country"": ""Brasil"", ""postalcode"": ""13560-290""}, {""street"": ""RUA DONA ALEXANDRINA, 366"", ""city"": ""São Carlos"", ""state"": ""SP"", ""country"": ""Brasil""}, {""postalcode"": ""13560-290"", ""city"": ""São Carlos"", ""state"": ""SP"", ""country"": ""Brasil""}, ""RUA DONA ALEXANDRINA, 366, São Carlos, SP, Brasil""]",no_valid_hit
"AVENIDA PROFESSORA MARIA DE CRESCI LEOPOLDINO, 755 - CASA  34 - CONDOMINIO RESIDENCIAL QUEBEC - São Carlos/SP - CEP 13563-623","{'street': 'AV ENIDA PROFESSORA MARIA DE CRESCI LEOPOLDINO, 755, CASA 34, CONDOMINIO RESIDENCIAL QUEBEC, SÃO CARLOS/SP', 'city': 'São Carlos', 'state': 'SP', 'country': 'Brasil', 'postalcode': '13563-623'}",False,False,"[{""street"": ""AV ENIDA PROFESSORA MARIA DE CRESCI LEOPOLDINO, 755, CASA 34, CONDOMINIO RESIDENCIAL QUEBEC, SÃO CARLOS/SP"", ""city"": ""São Carlos"", ""state"": ""SP"", ""country"": ""Brasil"", ""postalcode"": ""13563-623""}, {""street"": ""AV ENIDA PROFESSORA MARIA DE CRESCI LEOPOLDINO, 755, CASA 34, CONDOMINIO RESIDENCIAL QUEBEC, SÃO CARLOS/SP"", ""city"": ""São Carlos"", ""state"": ""SP"", ""country"": ""Brasil""}, {""postalcode"": ""13563-623"", ""city"": ""São Carlos"", ""state"": ""SP"", ""country"": ""Brasil""}, ""AV ENIDA PROFESSORA MARIA DE CRESCI LEOPOLDINO, 755, CASA 34, CONDOMINIO RESIDENCIAL QUEBEC, SÃO CARLOS/SP, São Carlos, SP, Brasil""]",no_valid_hit
"RUA SAO JOAQUIM, 1454 - VILA MONTEIRO (GLEBA I) - São Carlos/SP - CEP 13560-300","{'street': 'RUA SAO JOAQUIM, 1454, VILA MONTEIRO, SÃO CARLOS/SP', 'city': 'São Carlos', 'state': 'SP', 'country': 'Brasil', 'postalcode': '13560-300'}",False,False,"[{""street"": ""RUA SAO JOAQUIM, 1454, VILA MONTEIRO, SÃO CARLOS/SP"", ""city"": ""São Carlos"", ""state"": ""SP"", ""country"": ""Brasil"", ""postalcode"": ""13560-300""}, {""street"": ""RUA SAO JOAQUIM, 1454, VILA MONTEIRO, SÃO CARLOS/SP"", ""city"": ""São Carlos"", ""state"": ""SP"", ""country"": ""Brasil""}, {""postalcode"": ""13560-300"", ""city"": ""São Carlos"", ""state"": ""SP"", ""country"": ""Brasil""}, ""RUA SAO JOAQUIM, 1454, VILA MONTEIRO, SÃO CARLOS/SP, São Carlos, SP, Brasil""]",no_valid_hit
"RUA BASILIO DIBBO, 305 - JARDIM CRUZEIRO DO SUL - São Carlos/SP - CEP 13572-070","{'street': 'RUA BASILIO DIBBO, 305, JARDIM CRUZEIRO DO SUL, SÃO CARLOS/SP', 'city': 'São Carlos', 'state': 'SP', 'country': 'Brasil', 'postalcode': '13572-070'}",False,False,"[{""street"": ""RUA BASILIO DIBBO, 305, JARDIM CRUZEIRO DO SUL, SÃO CARLOS/SP"", ""city"": ""São Carlos"", ""state"": ""SP"", ""country"": ""Brasil"", ""postalcode"": ""13572-070""}, {""street"": ""RUA BASILIO DIBBO, 305, JARDIM CRUZEIRO DO SUL, SÃO CARLOS/SP"", ""city"": ""São Carlos"", ""state"": ""SP"", ""country"": ""Brasil""}, {""postalcode"": ""13572-070"", ""city"": ""São Carlos"", ""state"": ""SP"", ""country"": ""Brasil""}, ""RUA BASILIO DIBBO, 305, JARDIM CRUZEIRO DO SUL, SÃO CARLOS/SP, São Carlos, SP, Brasil""]",no_valid_hit
"RUA MADRE SAINT BERNARD, 861 - JARDIM PARAISO - São Carlos/SP - CEP 13561-190","{'street': 'RUA MADRE SAINT BERNARD, 861, JARDIM PARAISO, SÃO CARLOS/SP', 'city': 'São Carlos', 'state': 'SP', 'country': 'Brasil', 'postalcode': '13561-190'}",False,False,"[{""street"": ""RUA MADRE SAINT BERNARD, 861, JARDIM PARAISO, SÃO CARLOS/SP"", ""city"": ""São Carlos"", ""state"": ""SP"", ""country"": ""Brasil"", ""postalcode"": ""13561-190""}, {""street"": ""RUA MADRE SAINT BERNARD, 861, JARDIM PARAISO, SÃO CARLOS/SP"", ""city"": ""São Carlos"", ""state"": ""SP"", ""country"": ""Brasil""}, {""postalcode"": ""13561-190"", ""city"": ""São Carlos"", ""state"": ""SP"", ""country"": ""Brasil""}, ""RUA MADRE SAINT BERNARD, 861, JARDIM PARAISO, SÃO CARLOS/SP, São Carlos, SP, Brasil""]",no_valid_hit
"AVENIDA SAO CARLOS, 1031 - CENTRO - São Carlos/SP - CEP 13560-002","{'street': 'AV ENIDA SAO CARLOS, 1031, CENTRO, SÃO CARLOS/SP', 'city': 'São Carlos', 'state': 'SP', 'country': 'Brasil', 'postalcode': '13560-002'}",False,False,"[{""street"": ""AV ENIDA SAO CARLOS, 1031, CENTRO, SÃO CARLOS/SP"", ""city"": ""São Carlos"", ""state"": ""SP"", ""country"": ""Brasil"", ""postalcode"": ""13560-002""}, {""street"": ""AV ENIDA SAO CARLOS, 1031, CENTRO, SÃO CARLOS/SP"", ""city"": ""São Carlos"", ""state"": ""SP"", ""country"": ""Brasil""}, {""postalcode"": ""13560-002"", ""city"": ""São Carlos"", ""state"": ""SP"", ""country"": ""Brasil""}, ""AV ENIDA SAO CARLOS, 1031, CENTRO, SÃO CARLOS/SP, São Carlos, SP, Brasil""]",no_valid_hit
"RUA EPISCOPAL, 1149 - CENTRO - São Carlos/SP - CEP 13560-570","{'street': 'RUA EPISCOPAL, 1149, CENTRO, SÃO CARLOS/SP', 'city': 'São Carlos', 'state': 'SP', 'country': 'Brasil', 'postalcode': '13560-570'}",False,False,"[{""street"": ""RUA EPISCOPAL, 1149, CENTRO, SÃO CARLOS/SP"", ""city"": ""São Carlos"", ""state"": ""SP"", ""country"": ""Brasil"", ""postalcode"": ""13560-570""}, {""street"": ""RUA EPISCOPAL, 1149, CENTRO, SÃO CARLOS/SP"", ""city"": ""São Carlos"", ""state"": ""SP"", ""country"": ""Brasil""}, {""postalcode"": ""13560-570"", ""city"": ""São Carlos"", ""state"": ""SP"", ""country"": ""Brasil""}, ""RUA EPISCOPAL, 1149, CENTRO, SÃO CARLOS/SP, São Carlos, SP, Brasil""]",no_valid_hit
"RUA LUIZ ROHER, 975 - JARDIM RICETTI - São Carlos/SP - CEP 13570-002","{'street': 'RUA LUIZ ROHER, 975, JARDIM RICETTI, SÃO CARLOS/SP', 'city': 'São Carlos', 'state': 'SP', 'country': 'Brasil', 'postalcode': '13570-002'}",False,False,"[{""street"": ""RUA LUIZ ROHER, 975, JARDIM RICETTI, SÃO CARLOS/SP"", ""city"": ""São Carlos"", ""state"": ""SP"", ""country"": ""Brasil"", ""postalcode"": ""13570-002""}, {""street"": ""RUA LUIZ ROHER, 975, JARDIM RICETTI, SÃO CARLOS/SP"", ""city"": ""São Carlos"", ""state"": ""SP"", ""country"": ""Brasil""}, {""postalcode"": ""13570-002"", ""city"": ""São Carlos"", ""state"": ""SP"", ""country"": ""Brasil""}, ""RUA LUIZ ROHER, 975, JARDIM RICETTI, SÃO CARLOS/SP, São Carlos, SP, Brasil""]",no_valid_hit
"AVENIDA SAVERIO TALARICO, 220 - JARDIM RICETTI - São Carlos/SP - CEP 13570-090","{'street': 'AV ENIDA SAVERIO TALARICO, 220, JARDIM RICETTI, SÃO CARLOS/SP', 'city': 'São Carlos', 'state': 'SP', 'country': 'Brasil', 'postalcode': '13570-090'}",False,False,"[{""street"": ""AV ENIDA SAVERIO TALARICO, 220, JARDIM RICETTI, SÃO CARLOS/SP"", ""city"": ""São Carlos"", ""state"": ""SP"", ""country"": ""Brasil"", ""postalcode"": ""13570-090""}, {""street"": ""AV ENIDA SAVERIO TALARICO, 220, JARDIM RICETTI, SÃO CARLOS/SP"", ""city"": ""São Carlos"", ""state"": ""SP"", ""country"": ""Brasil""}, {""postalcode"": ""13570-090"", ""city"": ""São Carlos"", ""state"": ""SP"", ""country"": ""Brasil""}, ""AV ENIDA SAVERIO TALARICO, 220, JARDIM RICETTI, SÃO CARLOS/SP, São Carlos, SP, Brasil""]",no_valid_hit
"RUA DOMINGOS DE ANGELIS, 423 - JARDIM SAO RAFAEL - São Carlos/SP - CEP 13568-080","{'street': 'RUA DOMINGOS DE ANGELIS, 423, JARDIM SAO RAFAEL, SÃO CARLOS/SP', 'city': 'São Carlos', 'state': 'SP', 'country': 'Brasil', 'postalcode': '13568-080'}",False,False,"[{""street"": ""RUA DOMINGOS DE ANGELIS, 423, JARDIM SAO RAFAEL, SÃO CARLOS/SP"", ""city"": ""São Carlos"", ""state"": ""SP"", ""country"": ""Brasil"", ""postalcode"": ""13568-080""}, {""street"": ""RUA DOMINGOS DE ANGELIS, 423, JARDIM SAO RAFAEL, SÃO CARLOS/SP"", ""city"": ""São Carlos"", ""state"": ""SP"", ""country"": ""Brasil""}, {""postalcode"": ""13568-080"", ""city"": ""São Carlos"", ""state"": ""SP"", ""country"": ""Brasil""}, ""RUA DOMINGOS DE ANGELIS, 423, JARDIM SAO RAFAEL, SÃO CARLOS/SP, São Carlos, SP, Brasil""]",no_valid_hit
"RUA ANTONIO FISCHER DOS SANTOS, 380 - LOTE  04                  QUADRAJ - JARDIM PAULISTANO - São Carlos/SP - CEP 13564-390","{'street': 'RUA ANTONIO FISCHER DOS SANTOS, 380, LOTE 04 QUADRAJ, JARDIM PAULISTANO, SÃO CARLOS/SP', 'city': 'São Carlos', 'state': 'SP', 'country': 'Brasil', 'postalcode': '13564-390'}",False,False,"[{""street"": ""RUA ANTONIO FISCHER DOS SANTOS, 380, LOTE 04 QUADRAJ, JARDIM PAULISTANO, SÃO CARLOS/SP"", ""city"": ""São Carlos"", ""state"": ""SP"", ""country"": ""Brasil"", ""postalcode"": ""13564-390""}, {""street"": ""RUA ANTONIO FISCHER DOS SANTOS, 380, LOTE 04 QUADRAJ, JARDIM PAULISTANO, SÃO CARLOS/SP"", ""city"": ""São Carlos"", ""state"": ""SP"", ""country"": ""Brasil""}, {""postalcode"": ""13564-390"", ""city"": ""São Carlos"", ""state"": ""SP"", ""country"": ""Brasil""}, ""RUA ANTONIO FISCHER DOS SANTOS, 380, LOTE 04 QUADRAJ, JARDIM PAULISTANO, SÃO CARLOS/SP, São Carlos, SP, Brasil""]",no_valid_hit
"RUA BENEDITO DA SILVA, 1077 - JARDIM SAO CARLOS - São Carlos/SP - CEP 13560-645","{'street': 'RUA BENEDITO DA SILVA, 1077, JARDIM SAO CARLOS, SÃO CARLOS/SP', 'city': 'São Carlos', 'state': 'SP', 'country': 'Brasil', 'postalcode': '13560-645'}",False,False,"[{""street"": ""RUA BENEDITO DA SILVA, 1077, JARDIM SAO CARLOS, SÃO CARLOS/SP"", ""city"": ""São Carlos"", ""state"": ""SP"", ""country"": ""Brasil"", ""postalcode"": ""13560-645""}, {""street"": ""RUA BENEDITO DA SILVA, 1077, JARDIM SAO CARLOS, SÃO CARLOS/SP"", ""city"": ""São Carlos"", ""state"": ""SP"", ""country"": ""Brasil""}, {""postalcode"": ""13560-645"", ""city"": ""São Carlos"", ""state"": ""SP"", ""country"": ""Brasil""}, ""RUA BENEDITO DA SILVA, 1077, JARDIM SAO CARLOS, SÃO CARLOS/SP, São Carlos, SP, Brasil""]",no_valid_hit
